NÓN RỘNG VÀNH  ĐI  BIỂN THỜI TRANG MỚI - DN19VN0738,DONA Thời Trang,99000.0,OEM,1.0,5.0,7.0,Nón/Mũ,VND,0
"Nón len nam, mũ len nam thời trang Hàn Quốc dn19122411",DONA Thời Trang,99000.0,OEM,2.0,5.0,5.0,Nón/Mũ,VND,0
NÓN MŨ BERE LEN LÔNG THỎ THỜI TRANG HÀN QUỐC DN19122307,DONA Thời Trang,160000.0,OEM,1.0,5.0,4.0,Nón/Mũ,VND,0
MŨ CÓI ĐI BIỀN ĐẸP THỜI TRANG MỚI - DN19VN0734,DONA Thời Trang,99000.0,OEM,2.0,4.5,6.0,Nón/Mũ,VND,0
NÓN MŨ BERE LEN LÔNG THỎ THỜI TRANG HÀN QUỐC DN19122314,DONA Thời Trang,160000.0,OEM,3.0,3.7,3.0,Nón/Mũ,VND,0
Khăn choàng len nữ đa năng thời trang thanh lịch dona21101914,DONA Thời Trang,99000.0,OEM,1.0,1.0,2.0,Khăn,VND,0
Áo len nữ thời trang chất mịn đẹp,Haint Boutique Official,220000.0,Haint Boutique,5.0,4.5,13.0,Áo,VND,0
Túi du lịch thời trang HARAS HR257,HARASMALL,190000.0,HARAS,81.0,4.5,242.0,Túi,VND,0
Giày Đi Mưa Thời Trang Nữ Cao Cấp,STORE HT,99000.0,HT Sports,12.0,4.8,43.0,Giày,VND,0
Túi đeo chéo thời trang BEE GEE 037,BEE GEE SHOP,65000.0,Bee Gee,6.0,4.3,115.0,Túi,VND,0
Túi xách nữ thời trang LATA TX09,LATA OFFICIAL,465000.0,Lata,2.0,5.0,23.0,Túi,VND,0
Túi xách nữ thời trang ELLY – EL263,ELLY,934300.0,Elly,1.0,5.0,1.0,Túi,VND,0
Cặp Công Sở Thời Trang Yuumy Cayuumy 02,LATA OFFICIAL,235000.0,YUUMY,8.0,4.5,29.0,Balo/Cặp,VND,0
ÁO PHÔNG THỜI TRANG RẰN RI MÃ 01,Đại lý X26 Lục Quân,90000.0,OEM,1.0,5.0,7.0,Áo,VND,0
Balo nữ thời trang YUUMY Seasand YBA36,YUUMY OFFICIAL,189050.0,YUUMY,6.0,4.2,18.0,Balo/Cặp,VND,0
Vòng tay thời trang làm thủ công 100%,Anna Trần Shop,68000.0,Anna Tran,1.0,5.0,1.0,Vòng,VND,0
Dây chuyền kèm nhẫn thời trang Hàn Quôc,MUANHANH,118000.0,CHONMUA 365,2.0,5.0,12.0,Phụ kiện,VND,0
SET BỘ THUN DA CÁ THỜI TRANG NỮ,New Sky Shop 18,133000.0,OEM,1.0,5.0,7.0,Bộ,VND,0
Đầm Body lệch vai rút dây thời trang,Hương Nemo Style,145000.0,VONESA,5.0,3.2,9.0,Đầm,VND,0
Ba Lô Thời Trang Hàn Quốc HARAS HR0013,HARASMALL,190000.0,HARAS,6.0,3.0,120.0,Balo/Cặp,VND,0
Ví thời trang tiện ích HARAS HR274,HARASMALL,65000.0,HARAS,22.0,4.8,120.0,Túi,VND,0
Balo nữ thời trang YUUMY Seasand YBA36,LATA OFFICIAL,189050.0,YUUMY,61.0,4.7,186.0,Balo/Cặp,VND,0
Cặp công sở thời trang YUUMY CAYUUMY 11,LATA OFFICIAL,255000.0,YUUMY,12.0,4.6,28.0,Balo/Cặp,VND,0
Túi TOTE Thiết Kế Thời Trang Hàn Quốc,FALDO,89000.0,FALDO,5.0,4.8,48.0,Túi,VND,0
Xe đạp thời trang Asama CLD SW 2702,Shopquyetnam,3960000.0,Asama,1.0,5.0,4.0,Khác,VND,-1
Áo khoác thời trang,Haki Fashion.,235000.0,HAKI Fashion,8.0,4.3,16.0,Áo,VND,0
Túi du lịch thời trang YUUMY YMTR03,LATA OFFICIAL,400000.0,YUUMY,26.0,5.0,68.0,Túi,VND,0
Túi đeo ipad thời trang HARAS HRLT226,HARASMALL,89000.0,HARAS,56.0,4.6,372.0,Túi,VND,-1
Khăn choàng nữ thời trang cashmere HNS-10,HOANG NAM,89000.0,OEM,1.0,4.0,32.0,Khăn,VND,0
Thuốc Nhuộm Màu Thời Trang BOSNIC 150ML,Linh Giang Cosmetic,189000.0,BOSNIC,2.0,5.0,16.0,Khác,VND,0
MŨ BẢO HIỂM 1/2_2022 THỜI TRANG,YAMAHA MOTOR VIỆT NAM,185613.0,Yamaha,12.0,5.0,47.0,Nón/Mũ,VND,0
Kính mát nam EXFASH EF28971 thời trang,Number One Fashion,509000.0,Exfash,1.0,1.0,1.0,Mắt Kính,VND,0
Vòng tay thép titan thời trang nam nữ,MUANHANH,88000.0,CHONMUA 365,5.0,4.5,9.0,Vòng,VND,0
Balo thời trang WIill mesh N1 Shalla,Shalla,48025.0,Shalla,3.0,4.3,37.0,Balo/Cặp,VND,0
Túi Đeo Chéo Thời Trang HARAS HR253,HARASMALL,79000.0,HARAS,35.0,4.8,177.0,Túi,VND,0
Bộ Sách Kinh Doanh Thời Trang Thành Công,GIVER BOOKS & MEDIA,367000.0,OEM,3.0,5.0,10.0,Bộ,VND,0
Balo Du Lịch Thời Trang Uniex STARGO SELINA,SAKOS Official Store,299000.0,STARGO,12.0,4.5,46.0,Balo/Cặp,VND,0
Túi xách nữ thời trang ELLY – EL246,ELLY,1034100.0,Elly,1.0,5.0,3.0,Túi,VND,0
Túi xách nữ thời trang ELLY – EL248,ELLY,1304100.0,Elly,1.0,5.0,2.0,Túi,VND,0
Túi xách nữ thời trang ELLY – EL258,ELLY,994200.0,Elly,1.0,5.0,1.0,Túi,VND,0
Ba Lô Thời Trang Hàn Quốc HARAS HRTK232,HARASMALL,300000.0,HARAS,1.0,3.0,22.0,Balo/Cặp,VND,0
Áo da lót dù thời trang cao cấp,Xưởng Quần Áo Đẹp,374000.0,VONESA,3.0,3.7,4.0,Áo,VND,0
Khăn choàng nữ thời trang cashmere HNS-05,HOANG NAM,89000.0,OEM,6.0,5.0,31.0,Khăn,VND,0
Ví Nam Thời Trang cao cấp – VN1010,BEE GEE SHOP,410000.0,Bee Gee,1.0,5.0,2.0,Túi,VND,0
Quần Jogger 3 sọc thời trang đường phố,Xưởng Quần Áo Đẹp,119000.0,VONESA,1.0,5.0,1.0,Quần,VND,0
Vòng đeo tay lắc tay thời trang titan,MUANHANH,98000.0,ROSAVAN,4.0,4.8,8.0,Vòng,VND,0
Áo nữ thời trang vạt chéo ale25,Haint Boutique Official,220000.0,Haint Boutique,1.0,3.0,20.0,Áo,VND,0
Giày thời trang nam NIKE AIR MAX EXCEE,Tiki Trading,2089000.0,Nike,5.0,5.0,26.0,Giày,VND,-1
Giày thời trang Nữ NIKE W KILLSHOT 2,Tiki Trading,2379000.0,Nike,1.0,5.0,1.0,Giày,VND,-1
Ba Lô Thời Trang Hàn Quốc HARAS HR255,HARASMALL,190000.0,HARAS,15.0,4.0,173.0,Balo/Cặp,VND,0
Balo Đeo Chéo Thời Trang Nam YBAC2,LATA OFFICIAL,189000.0,YUUMY,25.0,5.0,69.0,Balo/Cặp,VND,0
Túi đeo chéo nam thời trang cao cấp ,Ananshop688,450000.0,ANANSHOP688,6.0,4.7,27.0,Túi,VND,0
Túi du lịch thời trang YUUMY YMTR04,LATA OFFICIAL,410000.0,YUUMY,22.0,4.6,42.0,Túi,VND,0
Túi xách nữ thời trang ELLY – EL239,ELLY,1004300.0,Elly,1.0,5.0,2.0,Túi,VND,0
Balo da nam thời trang LATA BAL47,LATA OFFICIAL,750000.0,Lata,8.0,5.0,18.0,Balo/Cặp,VND,0
Kẹp Búi Tóc Lưới Thời Trang Cao Cấp,Vnhaxanh,54000.0,OEM,2.0,5.0,21.0,Phụ kiện,VND,0
Dép Da Nam Thời Trang Thanh Lịch VYFASHION,DONAVY SHOP,269000.0,DONAVY,1.0,5.0,2.0,Dép,VND,0
Candy Book - Phong Cách Thời Trang Của Tôi,Tân Việt,52000.0,OEM,1.0,5.0,147.0,Khác,VND,0
Túi đeo chéo nam thời trang cao cấp,Ananshop688,315000.0,ANANSHOP688,14.0,4.1,33.0,Túi,VND,0
Hộp Đựng Kính Thời Trang Bằng Da PU,MuaMuaOnline,17000.0,OEM,2.0,3.0,6.0,Mắt Kính,VND,0
Giày thời trang Nữ WMNS NIKE GAMMA FORCE - SAIL/LIGHT SILVER-SEA GLASS-COCONUT MILK - 8 US,Tiki Trading,1889000.0,Nike,3.0,5.0,10.0,Giày,VND,0
Áo len nữ thời trang chất dày mịn,Moon Fashion,149000.0,TAKIHA,1.0,4.0,23.0,Áo,VND,0
Balo Du Lịch Thời Trang Unisex STARGO LIGERO,SAKOS Official Store,440000.0,STARGO,7.0,4.6,54.0,Balo/Cặp,VND,0
AS - ÁO MƯA TRONG THỜI TRANG SIZE L,Quatangsongvui,112000.0,FWD,1.0,5.0,15.0,Áo,VND,0
Balo Nam Nữ Thời Trang HARAS HR270,HARASMALL,139000.0,HARAS,60.0,4.3,157.0,Balo/Cặp,VND,0
Balo Thiết Kế Thời Trang Hàn Quốc FALDO,FALDO,193000.0,FALDO,14.0,4.3,38.0,Balo/Cặp,VND,0
Túi xách nữ thời trang ELLY – EL259,ELLY,994200.0,Elly,1.0,5.0,1.0,Túi,VND,0
Túi xách nữ thời trang ELLY – EL224,ELLY,934300.0,Elly,1.0,5.0,1.0,Túi,VND,0
Dây Lưng Nữ Thời Trang Cao Cấp Elly - ED29,ELLY,181300.0,Elly,3.0,4.0,13.0,Khác,VND,0
Bộ 3 Ba Lô Thời Trang HARAS HR247,HARASMALL,350000.0,HARAS,2.0,3.5,17.0,Balo/Cặp,VND,0
Túi Đeo Da Thời Trang HARAS HRTK054  - Đen,HARASMALL,320000.0,HARAS,2.0,4.0,16.0,Túi,VND,0
Áo Đũi Nam Thời Trang SZone SA501,SZone,89000.0,SZone,1.0,1.0,6.0,Áo,VND,0
Bông tai dài 3 tua rua thời trang,haopo,70000.0,OEM,1.0,5.0,2.0,Phụ kiện,VND,0
Đầm bầu đẹp - váy bầu xinh thời trang Hàn Quốc DN1907022A,DONA Thời Trang,154000.0,OEM,3.0,5.0,15.0,Váy,VND,0
Sét đồ bộ nữ phối sọc in chữ thời trang thun cotton 100,THỜI TRANG TINA,219000.0,OEM,1.0,5.0,2.0,Bộ,VND,0
NÓN MŨ LEN BERE LÔNG THỎ BLOOM THỜI TRANG HÀN QUỐC DN19111708,DONA Thời Trang,164000.0,OEM,1.0,5.0,8.0,Nón/Mũ,VND,0
MŨ RỘNG VÀNH NỮ THỜI TRANG HÀN QUỐC MỚI - DN19VN0727,DONA Thời Trang,99000.0,OEM,3.0,3.7,16.0,Nón/Mũ,VND,0
NÓN MŨ LEN BERE LÔNG THỎ WINTER THỜI TRANG HÀN QUỐC DN19111709,DONA Thời Trang,170000.0,OEM,1.0,5.0,10.0,Nón/Mũ,VND,0
Khăn choàng nam cao cấp thời trang Hàn Quốc màu xanh dn19121518,DONA Thời Trang,327000.0,OEM,2.0,2.5,9.0,Khăn,VND,0
Mũ Len Nữ Nón Len Nữ slightly thời trang Hàn Quốc - DONA21012102,DONA Thời Trang,144000.0,OEM,1.0,5.0,2.0,Nón/Mũ,VND,0
Khăn lụa thời trang Hàn Quốc thắt nhiều kiểu AKL25 họa tiết nhỏ,Ant home,59000.0,Song An Eco,2.0,5.0,16.0,Khăn,VND,0
NÓN MŨ LEN BERE LÔNG THỎ THỜI TRANG HÀN QUỐC DN19111708E,DONA Thời Trang,160000.0,OEM,1.0,4.0,4.0,Nón/Mũ,VND,0
Dán Hình Sáng Tạo Trang Phục Búp Bê - Nhà Thiết Kế Thời Trang,Tiki Trading,55300.0,OEM,7.0,5.0,237.0,Khác,VND,0
Balo thời trang nam phong cách mới BEE GEE BLN1004A-TRANG,BEE GEE SHOP,655000.0,Bee Gee,1.0,5.0,1.0,Balo/Cặp,VND,0
Jumpsuit Jean Short V viền cổ sọc thời trang Cao Cấp TP07,THỜI TRANG TINA,185000.0,OEM,1.0,5.0,1.0,Khác,VND,0
NÓN BERE DA MŨ NỒI BERET NAM THỜI TRANG CHÂU ÂU - DONA21012802,DONA Thời Trang,114000.0,OEM,4.0,5.0,24.0,Nón/Mũ,VND,0
Khăn choàng nam cao cấp thời trang Hàn Quốc màu xanh dn19121520,DONA Thời Trang,327000.0,OEM,1.0,5.0,8.0,Khăn,VND,0
Mũ Len Nam Đẹp Nón Len Nam Thời Trang Hàn Quốc DONA201222101,DONA Thời Trang,130000.0,OEM,3.0,4.7,9.0,Nón/Mũ,VND,0
MŨ RỘNG VÀNH RỘNG VÀNH ĐẸP THỜI TRANG HÀN QUỐC MỚI dona21031804,DONA Thời Trang,164000.0,OEM,1.0,5.0,1.0,Nón/Mũ,VND,0
NÓN CAO BỒI NỮ THỜI TRANG HÀN QUỐC MỚI - DN19VN0708,DONA Thời Trang,99000.0,OEM,1.0,5.0,0.0,Nón/Mũ,VND,0
Đầm Lụa Trung Niên Thời Trang VH49 - Hàng Quảng Châu Cao Cấp,Avashop Thời Trang,335000.0,OEM,1.0,4.0,6.0,Đầm,VND,0
"Nón Đa năng, Tuban Mũ chụp Đầu thời trang Hàn Quốc  DONA20120202",DONA Thời Trang,124000.0,OEM,9.0,5.0,36.0,Nón/Mũ,VND,0
Nón mũ beret len lông thỏ Shinghi thời trang Hàn Quốc dn19081819,DONA Thời Trang,170000.0,OEM,5.0,5.0,20.0,Nón/Mũ,VND,0
Mũ beret nón len bere nữ thời trang Hàn Quốc mới dona21111216,DONA Thời Trang,164000.0,OEM,5.0,4.0,12.0,Nón/Mũ,VND,0
NÓN MŨ LEN BERE LÔNG THỎ THỜI TRANG HÀN QUỐC DN19111708A,DONA Thời Trang,160000.0,OEM,1.0,5.0,1.0,Nón/Mũ,VND,0
NÓN MŨ LEN BERE LÔNG THỎ THỜI TRANG HÀN QUỐC DN19111708F,DONA Thời Trang,160000.0,OEM,1.0,5.0,1.0,Nón/Mũ,VND,0
Khăn choàng nam cao cấp thời trang Hàn Quốc màu xanh dn19121528,DONA Thời Trang,292000.0,OEM,1.0,5.0,1.0,Khăn,VND,0
Áo croptop dài tay cổ vuông chất đẹp thời trang Banamo Fashion 3112,Thời trang Banamo,103000.0,OEM,2.0,3.5,3.0,Áo,VND,0
"Nón Đa năng, LOVE Mũ chụp Đầu thời trang Hàn Quốc  DONA20120203",DONA Thời Trang,124000.0,OEM,1.0,4.0,10.0,Nón/Mũ,VND,0
NÓN MŨ LEN BERE LÔNG THỎ THỜI TRANG HÀN QUỐC DN19111708E ,DONA Thời Trang,170000.0,OEM,3.0,5.0,12.0,Nón/Mũ,VND,0
NÓN MŨ LEN BERE LÔNG THỎ CLASS THỜI TRANG HÀN QUỐC DN19111710,DONA Thời Trang,164000.0,OEM,5.0,2.0,23.0,Nón/Mũ,VND,0
Khăn choàng nam cao cấp thời trang Hàn Quốc màu nâu dn19121516,DONA Thời Trang,327000.0,OEM,1.0,4.0,6.0,Khăn,VND,0
Áo Vest Nam Thời Trang Phối Viền Túi Nhiều Màu AVNM01,Xưởng May Thời Trang Nguyễn Hùng,189000.0,HM VESTON,44.0,3.6,117.0,Áo,VND,0
Jum họa tiết lông vũ thời trang nữ tính,Xưởng Quần Áo Đẹp,182000.0,VONESA,3.0,4.7,9.0,Khác,VND,0
Ba Lô Thời Trang Hàn Quốc HARAS HRTK206(ĐEN),HARASMALL,150000.0,HARAS,6.0,4.8,36.0,Balo/Cặp,VND,0
Đầm bầu đẹp - váy bầu xinh thời trang Hàn Quốc DN1907021A,DONA Thời Trang,154000.0,OEM,10.0,4.0,26.0,Váy,VND,0
Giày thời trang Nữ NIKE WMNS NIKE GAMMA FORCE,Tiki Trading,1889000.0,Nike,1.0,5.0,4.0,Giày,VND,0
Mũ beret nón bere len lông thỏ thời trang Hàn Quốc dona21111215,DONA Thời Trang,164000.0,OEM,1.0,5.0,1.0,Nón/Mũ,VND,0
Ba Lô Thời Trang Hàn Quốc HARAS HRTK213(Xám),HARASMALL,150000.0,HARAS,6.0,3.7,47.0,Balo/Cặp,VND,0
Ví Cầm Tay Unisex Thời Trang Đa Năng LATA VN32,LATA OFFICIAL,99000.0,Lata,10.0,4.5,144.0,Túi,VND,0
Áo len nữ thời trang kiểu dáng Hàn Quốc,Moon Fashion,149000.0,OEM,20.0,4.5,96.0,Áo,VND,0
Balo Nam Thời Trang Cao Cấp PRAZA - BLTK178,Praza,149000.0,Praza,36.0,4.8,185.0,Balo/Cặp,VND,0
QUẦN ÁO THỜI TRANG RẰN RI NÂU MÃ 372,Đại lý X26 Lục Quân,350000.0,OEM,1.0,4.0,1.0,Áo,VND,0
Đồng hồ Nam thời trang SKMEI 9140 - DHA519,hoangkim store1,399000.0,SKMEI,3.0,5.0,8.0,Đồng Hồ,VND,0
Túi xách du lịch thời trang HARAS HR224,HARASMALL,250000.0,HARAS,55.0,4.3,886.0,Túi,VND,-1
Dép Nữ Thời Trang Huy Hoàng HT7933 - Đen,Huy Hoang Official Store,293300.0,Huy Hoàng,2.0,4.5,10.0,Dép,VND,0
Giày Sandal Cao Su Chống Nước Thời Trang Unisex,GiayLeSang,59000.0,Lê Sang,18.0,4.7,32.0,Giày,VND,0
Balo Nữ Thời Trang Cao Cấp Elly EBH18,ELLY,864300.0,Elly,7.0,5.0,20.0,Balo/Cặp,VND,0
MŨ BẢO HIỂM 1/2 THỜI TRANG KIỂU 1,YAMAHA MOTOR VIỆT NAM,185613.0,Yamaha,12.0,5.0,76.0,Nón/Mũ,VND,0
Balo nữ thời trang cao cấp ELLY – EBH34,ELLY,1004300.0,Elly,6.0,4.8,19.0,Balo/Cặp,VND,0
Balo Ulzzang Hàn Quốc Thời Trang HARAS HR284,HARASMALL,179000.0,HARAS,72.0,4.6,178.0,Balo/Cặp,VND,0
Balo da nữ mini thời trang Lata BAL62,LATA OFFICIAL,344000.0,Lata,2.0,4.5,3.0,Balo/Cặp,VND,0
Balo Du Lịch Thời Trang Cao Cấp SAKOS LUXER,SAKOS Official Store,1563080.0,Sakos,7.0,4.0,48.0,Balo/Cặp,VND,0
Túi đeo chéo nam thời trang HARAS HR241,HARASMALL,150000.0,HARAS,42.0,3.9,333.0,Túi,VND,-1
Đồng Hồ Nam Thời Trang SKMEI 9101 - DHA345,hoangkim store1,299000.0,SKMEI,1.0,5.0,1.0,Đồng Hồ,VND,0
Túi Đeo Chéo Thời Trang SAKOS MINUS - Size S,SAKOS Official Store,743070.0,Sakos,2.0,5.0,11.0,Túi,VND,0
Túi xách du lịch thời trang HARAS HR230,HARASMALL,250000.0,HARAS,10.0,4.3,125.0,Túi,VND,0
Bộ balo túi xách nữ 3 món thời trang,Balo Teen,79000.0,HAKI,2.0,4.0,23.0,Túi,VND,0
Nhẫn nữ thời trang siêu xinh cho bạn nữ,MUANHANH,35000.0,ROSAVAN,37.0,4.5,235.0,Phụ kiện,VND,0
Túi Du Lịch Mr Vui DL100 thời trang,Balonation,359550.0,Mr.vui,9.0,4.8,23.0,Túi,VND,0
Túi Xách Du Lịch Thời Trang HARAS HRTK219,HARASMALL,180000.0,HARAS,3.0,4.3,133.0,Túi,VND,0
Áo sơ mi nam cổ trụ thời trang 2021,SOMINAM,149000.0,OEM,1.0,5.0,7.0,Áo,VND,0
Balo Du Lịch Thời Trang Cao Cấp SAKOS TRENDY,SAKOS Official Store,1637600.0,Sakos,1.0,5.0,1.0,Balo/Cặp,VND,0
Bông Tai Hoa Tai Nữ THỜI TRANG CAO CẤP,Lovelyladyshop,125000.0,OEM,1.0,5.0,2.0,Phụ kiện,VND,0
"Găng tay chống nắng thời trang, chống nắng tốt",Group Case TTM,15000.0,OEM,11.0,4.5,78.0,Găng Tay,VND,0
Ví dài cầm tay thời trang  YUUMY YV31,YUUMY OFFICIAL,275000.0,YUUMY,7.0,4.6,15.0,Túi,VND,0
Dép lê thời trang cao cấp cho bé 21746,ĐỒ DA THÀNH LONG TLG,122700.0,ĐỒ DA THÀNH LONG TLG,2.0,3.0,4.0,Dép,VND,0
Khăn choàng cổ lụa thời trang cao cấp 07,MISA Shop,234000.0,OEM,3.0,3.7,13.0,Khăn,VND,0
Khăn choàng cổ lụa thời trang cao cấp 39,MISA Shop,234000.0,OEM,2.0,4.0,7.0,Khăn,VND,0
Kính mát Mắt Tròn Nhỏ Mini Thời Trang Hottrend,Kính Xinh,169000.0,LALAMIA,1.0,3.0,3.0,Mắt Kính,VND,0
Dây chuyền vòng cổ ổ khoá thời trang unisex,MUANHANH,99000.0,CHONMUA 365,1.0,1.0,1.0,Vòng,VND,0
"Áo khoác kaki nam cao cấp thời trang, có túi trong tiện lợi cao cấp phong cách thời trang Dokafashion DKN15",Doka Fashion,209000.0,dokafashion,2.0,5.0,8.0,Áo,VND,0
Thắt Lưng Nữ Thời Trang Da PU Aaa Jeans,AAA Jeans,149000.0,AAA JEANS,28.0,5.0,114.0,Thắt Lưng,VND,0
Ba Lô Thời Trang Hàn Quốc HARAS HRTK213(Đỏ),HARASMALL,150000.0,HARAS,10.0,4.0,182.0,Balo/Cặp,VND,0
Ví nam thời trang da thật LATA LVN59,LATA OFFICIAL,335000.0,Lata,7.0,5.0,25.0,Túi,VND,0
Túi đeo chéo nam thời trang Trita RTN10,LATA OFFICIAL,139000.0,TRITA,6.0,5.0,20.0,Túi,VND,0
Balo Da Thời Trang Hàn Quốc HARAS HR271,HARASMALL,250000.0,HARAS,7.0,4.7,25.0,Balo/Cặp,VND,0
Khăn choàng nữ thời trang cao cấp HNS-08,HOANG NAM,129000.0,OEM,9.0,5.0,53.0,Khăn,VND,0
Áo Ba Lỗ Thời Trang Nam Owen LAW90836,AFAST VIỆT NAM,135000.0,Owen,4.0,5.0,26.0,Áo,VND,0
Đồng hồ Nam thời trang SKMEI 9058 - DHA020,hoangkim store1,299000.0,SKMEI,3.0,5.0,8.0,Đồng Hồ,VND,0
Túi Đeo Chéo Thời Trang Cao Cấp SAKOS VERAN,SAKOS Official Store,650070.0,Sakos,4.0,4.8,34.0,Túi,VND,0
 Khăn choàng cổ lụa thời trang cao cấp 05,MISA Shop,234000.0,OEM,1.0,5.0,7.0,Khăn,VND,0
Bông Tai Hoa Tai Nữ THỜI TRANG CAO CẤP ,Lovelyladyshop,70000.0,OEM,1.0,5.0,2.0,Phụ kiện,VND,0
Balo nữ thời trang cao cấp ELLY – EBH12,ELLY,1004300.0,Elly,10.0,4.8,21.0,Balo/Cặp,VND,0
Balo nữ thời trang cao cấp phong cách mới,Ananshop688,441000.0,ANANSHOP688,19.0,4.5,46.0,Balo/Cặp,VND,0
Khăn choàng cổ lụa thời trang cao cấp 25,MISA Shop,234000.0,OEM,5.0,5.0,27.0,Khăn,VND,0
Giày Nam Thời Trang Huy Hoàng HT7160 - Đen (Size,Huy Hoang Official Store,636300.0,Huy Hoàng,2.0,5.0,7.0,Giày,VND,0
Cài áo thời trang hoa đính đá(GC65),Thuần Việt,42000.0,Song An Eco,1.0,5.0,5.0,Áo,VND,0
Ba Lô Ulazzang Thời Trang Hàn Quốc Praza - BLTK188,Praza,179000.0,Praza,3.0,4.7,9.0,Balo/Cặp,VND,0
Dép Nữ Thời Trang Huy Hoàng HT7931 - Đỏ,Huy Hoang Official Store,293300.0,Huy Hoàng,2.0,4.0,5.0,Dép,VND,0
Quần lót Nam thời trang mẫu mới - QL004,shopthoitranganhnguyen,110000.0,OEM,4.0,4.8,8.0,Quần,VND,0
Balo nữ thời trang cao cấp ELLY – EBH54,ELLY,1004300.0,Elly,1.0,4.0,2.0,Balo/Cặp,VND,0
Khăn choàng cổ lụa thời trang cao cấp 01,MISA Shop,210000.0,OEM,1.0,5.0,6.0,Khăn,VND,0
Khăn choàng cổ lụa thời trang cao cấp 37,MISA Shop,234000.0,OEM,2.0,5.0,5.0,Khăn,VND,0
Khăn choàng cổ lụa thời trang cao cấp 42,MISA Shop,210000.0,OEM,1.0,3.0,6.0,Khăn,VND,0
Váy ngủ gợi cảm thời trang cổ chữ V,Beauty and Fashion,73500.0,OEM,4.0,4.8,23.0,Váy,VND,0
Ví Đựng Thời Trang Tiện Ich HARAS V268,HARASMALL,35000.0,HARAS,58.0,4.7,173.0,Túi,VND,0
Túi xách nữ thời trang cong sở cao cấp,Ananshop688,387000.0,ANANSHOP688,7.0,4.3,27.0,Túi,VND,0
Đồng hồ Nam thời trang SKMEI 9069 - DHA014,hoangkim store1,249000.0,SKMEI,14.0,4.8,31.0,Đồng Hồ,VND,0
balo nữ thời trang cao cấp phong cách mới,Ananshop688,387000.0,ANANSHOP688,19.0,4.5,44.0,Balo/Cặp,VND,0
Ví nam - nữ thời trang da thật LATA LVN56,LATA OFFICIAL,259000.0,Lata,4.0,4.3,7.0,Túi,VND,0
Vòng tay gốm thời trang Simple style VGOM21,Ant home,22000.0,Song An Eco,1.0,5.0,9.0,Vòng,VND,0
Dây đeo mắt kính đeo gọng kính thời trang,MUANHANH,98500.0,ROSAVAN,4.0,4.0,21.0,Mắt Kính,VND,0
Balo nữ thời trang cao cấp phong cách mới,Ananshop688,351000.0,ANANSHOP688,2.0,4.5,5.0,Balo/Cặp,VND,0
Cài áo thời trang đính đá xanh GC178,Thuần Việt,92000.0,Song An Eco,1.0,4.0,1.0,Áo,VND,0
Túi đeo chéo unisex thời trang HARAS HR276,HARASMALL,80000.0,HARAS,7.0,4.0,40.0,Túi,VND,0
Ví cầm tay nữ dáng ngang thời trang Lata VN65,LATA OFFICIAL,325000.0,Lata,2.0,5.0,4.0,Túi,VND,0
Giày sneaker tăng chiều cao thời trang nam - 977,GiayLeSang,420000.0,Giày Phong Cách Lê Sang S,3.0,4.7,12.0,Giày,VND,0
Túi đeo chéo du lịch nam nữ thời trang,BEE GEE SHOP,89000.0,Bee Gee,2.0,2.0,26.0,Túi,VND,0
Kỹ Thuật Móc Len Sợi - Thời Trang Hè Thu,Việt Thư Books,31080.0,OEM,2.0,5.0,11.0,Khác,VND,0
Khăn choàng nữ thời trang cao cấp HNS-02,HOANG NAM,129000.0,OEM,2.0,5.0,35.0,Khăn,VND,0
Túi Đeo Chéo Thời Trang HARAS HRTK147-Xanh Đậm,HARASMALL,65000.0,HARAS,13.0,4.2,301.0,Túi,VND,-1
Cài áo thời trang tulip đính đá (GC08),Thuần Việt,54000.0,OEM,1.0,5.0,11.0,Áo,VND,0
Cài áo thời trang mẫu xuất Hàn (GC16),Thuần Việt,65000.0,OEM,2.0,3.5,10.0,Áo,VND,0
Vòng tay gốm thời trang Simple style VGOM27,Ant home,19000.0,Song An Eco,2.0,5.0,8.0,Vòng,VND,0
Vòng tay gốm thời trang đơn giản VGOM33,Ant home,19000.0,Song An Eco,1.0,5.0,5.0,Vòng,VND,0
Hoa tai nữ thời trang khoen bấm HT154,haopo,85000.0,OEM,1.0,5.0,6.0,Khác,VND,0
Vòng tay gốm thời trang Simple style VGOM27,Song An Eco,22000.0,Song An Eco,1.0,5.0,1.0,Vòng,VND,0
Quần kaki nam phong cách jogger thời trang đẹp,Đầm YuRin,93000.0,OEM,5.0,4.0,12.0,Quần,VND,0
Sandal cao gót nữ thời trang phong cách 21820,TLG GOLD,328000.0,TLG,1.0,5.0,1.0,Giày,VND,0
"Mũ Lưỡi Trai Nam Thời Trang Lính Cao Cấp U368, Nón Kết Nam Vành Cong Thời Trang US ARMY -HÀNG CHÍNH HÃNG",US ARMY OFFICIAL,84500.0,US ARMY,60.0,4.6,217.0,Nón/Mũ,VND,0
Balo UNISEX Thời Trang Hàn Quốc HARAS HR265,HARASMALL,300000.0,HARAS,4.0,4.8,23.0,Balo/Cặp,VND,0
AIRism Áo Hoodie Chống UV Vải Mắt Lưới Kéo Khóa | Họa Tiết,UNIQLO,686000.0,UNIQLO,59.0,4.92,0.0,Áo,VND,0
Áo Parka Chống UV Bỏ Túi | Chống Nắng | Họa Tiết,UNIQLO,784000.0,UNIQLO,66.0,4.83,0.0,Áo,VND,0
Áo Parka Chống UV Bỏ Túi (Chống Nắng),UNIQLO,784000.0,UNIQLO,194.0,4.82,0.0,Áo,VND,0
AIRism Áo Hoodie Chống UV Vải Mắt Lưới Kéo Khóa,UNIQLO,686000.0,UNIQLO,1118.0,4.91,0.0,Áo,VND,-1
Áo Parka Hai Mặt,UNIQLO,784000.0,UNIQLO,289.0,4.91,0.0,Áo,VND,0
Áo Khoác Vải Jersey Mềm Dáng Rộng,UNIQLO,1275000.0,UNIQLO,64.0,4.89,0.0,Áo,VND,0
Áo Khoác Cản Gió Cổ Trụ,UNIQLO,1275000.0,UNIQLO,123.0,4.97,0.0,Áo,VND,0
Áo Khoác Len Dáng Ngắn | Kẻ Sọc,UNIQLO,784000.0,UNIQLO,34.0,4.97,0.0,Áo,VND,0
Áo Khoác Len Dáng Ngắn,UNIQLO,784000.0,UNIQLO,123.0,4.86,0.0,Áo,VND,0
Áo Khoác Thiết Kế | Set Up,UNIQLO,1275000.0,UNIQLO,9.0,5.0,0.0,Áo,VND,0
AIRism Áo Khoác Siêu Co Giãn Kéo Khóa,UNIQLO,686000.0,UNIQLO,21.0,4.76,0.0,Áo,VND,0
Áo Khoác Vải Jersey Dáng Relax,UNIQLO,980000.0,UNIQLO,87.0,4.92,0.0,Áo,VND,0
Áo Khoác Giả Lông Cừu Loại Dày Kéo Khóa,UNIQLO,588000.0,UNIQLO,357.0,4.91,0.0,Áo,VND,0
KAWS + Warhol Áo Khoác Coach,UNIQLO,1275000.0,UNIQLO,35.0,4.94,0.0,Áo,VND,0
KAWS + Warhol Áo Khoác Coach,UNIQLO,1275000.0,UNIQLO,49.0,4.9,0.0,Áo,VND,0
Áo Khoác Kiểu Sơ Mi Vải Double Face,UNIQLO,1275000.0,UNIQLO,6.0,4.83,0.0,Áo,VND,0
Áo Khoác Kiểu Sơ Mi Vải Double Face,UNIQLO,1275000.0,UNIQLO,1.0,5.0,0.0,Áo,VND,0
PUFFTECH Áo Khoác Chần Bông | Có Mũ,UNIQLO,1471000.0,UNIQLO,56.0,4.89,0.0,Áo,VND,0
PUFFTECH Áo Khoác Chần Bông Dáng Relax,UNIQLO,1471000.0,UNIQLO,4.0,5.0,0.0,Áo,VND,0
PUFFTECH Áo Gile Chần Bông Gọn Nhẹ,UNIQLO,980000.0,UNIQLO,1.0,5.0,0.0,Áo,VND,0
Áo Khoác Phao Lông Vũ Siêu Nhẹ,UNIQLO,1471000.0,UNIQLO,28.0,4.79,0.0,Áo,VND,0
Seamless Down Áo Parka,UNIQLO,2944000.0,UNIQLO,12.0,4.58,0.0,Áo,VND,-1
Áo Phao Gile Dáng Lửng,UNIQLO,1275000.0,UNIQLO,11.0,4.73,0.0,Áo,VND,0
Áo Thun Mini | Kẻ Sọc,UNIQLO,293000.0,UNIQLO,122.0,4.88,0.0,Áo,VND,0
AIRism Áo Thun Siêu Co Giãn Dáng Lửng,UNIQLO,293000.0,UNIQLO,1040.0,4.87,0.0,Áo,VND,-1
Áo Thun Mini,UNIQLO,293000.0,UNIQLO,1328.0,4.89,0.0,Áo,VND,-1
AIRism Cotton Áo Thun,UNIQLO,293000.0,UNIQLO,1132.0,4.89,0.0,Áo,VND,-1
Áo Thun Cổ Tròn,UNIQLO,293000.0,UNIQLO,5194.0,4.88,0.0,Áo,VND,-1
Áo Thun Gân Cổ Cao | Kẻ Sọc,UNIQLO,391000.0,UNIQLO,5.0,5.0,0.0,Áo,VND,0
Áo Giả Lông Cừu Đan Len Mềm Cổ Tròn,UNIQLO,391000.0,UNIQLO,115.0,4.9,0.0,Áo,VND,0
Áo Thun Gân Cổ Cao,UNIQLO,391000.0,UNIQLO,25.0,4.92,0.0,Áo,VND,0
SUPIMA Cotton Áo Thun | Không Tay,UNIQLO,293000.0,UNIQLO,13.0,5.0,0.0,Áo,VND,0
Áo Thun Vải Cotton Mềm Dáng Relax | Kẻ Sọc,UNIQLO,391000.0,UNIQLO,65.0,4.82,0.0,Áo,VND,0
Áo Thun Vải Pointelle | Cổ Henley,UNIQLO,293000.0,UNIQLO,104.0,4.88,0.0,Áo,VND,0
Áo Thun Vải Cotton Mềm Dáng Relax,UNIQLO,391000.0,UNIQLO,17.0,4.88,0.0,Áo,VND,0
Áo Thun Cotton Mềm Co Giãn,UNIQLO,391000.0,UNIQLO,21.0,5.0,0.0,Áo,VND,0
HEATTECH Extra Warm Cotton Áo Giữ Nhiệt | Cổ Tròn,UNIQLO,489000.0,UNIQLO,72.0,4.88,0.0,Áo,VND,0
Áo Thun Gân Mềm Cổ Tròn | Kẻ Sọc,UNIQLO,293000.0,UNIQLO,215.0,4.92,0.0,Áo,VND,0
Áo Thun Gân Mềm Cổ Tròn,UNIQLO,293000.0,UNIQLO,314.0,4.89,0.0,Áo,VND,0
Áo Thun Vải Waffle Cổ Tròn,UNIQLO,391000.0,UNIQLO,668.0,4.87,0.0,Áo,VND,0
HEATTECH Áo Giữ Nhiệt Giả Lông Cừu | Cổ Lọ,UNIQLO,391000.0,UNIQLO,506.0,4.85,0.0,Áo,VND,0
Áo Polo Dáng Lửng,UNIQLO,489000.0,UNIQLO,39.0,4.9,0.0,Áo,VND,0
Áo Polo Dáng Lửng | Kẻ Sọc,UNIQLO,489000.0,UNIQLO,14.0,5.0,0.0,Áo,VND,0
Áo Polo Vải Dry Pique | 2 Màu,UNIQLO,489000.0,UNIQLO,24.0,4.83,0.0,Áo,VND,0
Áo Polo Vải Dry Pique | Kẻ Sọc,UNIQLO,489000.0,UNIQLO,12.0,4.67,0.0,Áo,VND,0
Áo Polo Vải Dry Pique | Tipping,UNIQLO,489000.0,UNIQLO,150.0,4.89,0.0,Áo,VND,0
Áo Polo Vải Dry Pique | Kẻ Sọc,UNIQLO,489000.0,UNIQLO,88.0,4.86,0.0,Áo,VND,0
AIRism Cotton Áo Polo Vải Gân,UNIQLO,489000.0,UNIQLO,203.0,4.86,0.0,Áo,VND,0
Áo Polo Vải Dry Pique,UNIQLO,489000.0,UNIQLO,1120.0,4.84,0.0,Áo,VND,-1
Áo Polo Dệt Kim Vải Gân Có Thể Giặt Máy,UNIQLO,588000.0,UNIQLO,112.0,4.95,0.0,Áo,VND,0
Áo Polo Cardigan Len Merino,UNIQLO,686000.0,UNIQLO,3.0,2.33,0.0,Áo,VND,0
AIRism Cotton Áo Thun,UNIQLO,489000.0,UNIQLO,298.0,4.79,0.0,Áo,VND,0
AIRism Cotton Áo Thun Dáng Rộng | Tay Lỡ,UNIQLO,391000.0,UNIQLO,1611.0,4.87,0.0,Áo,VND,-1
AIRism Cotton Áo Thun Dáng Rộng | Kẻ Sọc,UNIQLO,391000.0,UNIQLO,758.0,4.85,0.0,Áo,VND,0
Áo Thun Cổ Tròn,UNIQLO,293000.0,UNIQLO,3760.0,4.81,0.0,Áo,VND,-1
Áo Bra Top Dáng Lửng | Ringer,UNIQLO,489000.0,UNIQLO,161.0,4.92,0.0,Áo,VND,0
Áo Bra Dáng Lửng Không Tay,UNIQLO,489000.0,UNIQLO,555.0,4.9,0.0,Áo,VND,0
Áo Bra Top Dáng Lửng | Kẻ Sọc,UNIQLO,489000.0,UNIQLO,245.0,4.88,0.0,Áo,VND,0
Áo Bra Top Cổ Yếm | Kẻ Sọc,UNIQLO,489000.0,UNIQLO,86.0,4.91,0.0,Áo,VND,0
Áo Bra Top Cổ Yếm,UNIQLO,489000.0,UNIQLO,556.0,4.87,0.0,Áo,VND,0
AIRism Cotton Áo Bra Quây Dáng Ngắn,UNIQLO,489000.0,UNIQLO,336.0,4.82,0.0,Áo,VND,0
