Tên sản phẩm,Tên cửa hàng,Giá,Thương hiệu,Lượt đánh giá,Điểm đánh giá trung bình,Số lượng đã bán,Category,Currency,Cluster
Đầm Jean Nữ Thời Trang,THỜI TRANG TINA,235000.0,OEM,4.0,4.3,11.0,Đầm,VND,0
Đầm Jean Nữ Thắt Dây Eo Thời Trang,THỜI TRANG TINA,199000.0,OEM,1.0,4.0,2.0,Đầm,VND,0
Đầm Xòe Công Sở Phối Lưới Thời Trang,THỜI TRANG TINA,148500.0,OEM,1.0,4.0,1.0,Đầm,VND,0
Đầm Nữ Thời Trang Phối Hoa Rời-V6,THỜI TRANG TINA,149000.0,OEM,1.0,1.0,2.0,Đầm,VND,0
Đầm xòe nhún vai kết hạt trai thời trang a b c,THỜI TRANG TINA,99000.0,OEM,28.0,3.3,67.0,Đầm,VND,0
Váy Đầm Che Bụng Thời Trang VH91 - Hàng Quảng Châu Cao Cấp,Avashop Thời Trang,370000.0,OEM,1.0,5.0,5.0,Váy,VND,0
Đầm nữ bông xếp tầng thời trang,Hương Nemo Style,155000.0,VONESA,1.0,4.0,5.0,Đầm,VND,0
Đầm nữ tay lưới dáng xòe thời trang,Hương Nemo Style,145000.0,VONESA,1.0,5.0,1.0,Đầm,VND,0
Đầm nữ voan lụa thời trang cao cấp,Hương Nemo Style,145000.0,VONESA,1.0,4.0,1.0,Đầm,VND,0
ĐẦM XOÈ CÔNG SỞ DỰ TIỆC RÚT EO THỜI TRANG HÀN QUỐC DN20101101,DONA Thời Trang,194000.0,OEM,1.0,4.0,1.0,Đầm,VND,0
Đầm Ngắn Sơmi Nữ Thời Trang JUNO Thun Eo JNDLU014,JUNO,595000.0,Juno,1.0,5.0,3.0,Đầm,VND,0
Đầm Dài Nữ Thời Trang JUNO Dây Bản To JNDLU024 - M,JUNO,595000.0,Juno,1.0,5.0,1.0,Đầm,VND,0
Đầm Mini Nữ Thời Trang JUNO Tay Vai Lệch JNDLU021,JUNO,595000.0,Juno,1.0,5.0,1.0,Đầm,VND,0
Đầm Midi Nữ Thời Trang JUNO Kiểu Hai Dây Cut Out JNDLU043,JUNO,595000.0,Juno,1.0,5.0,1.0,Đầm,VND,0
Đầm Xoè Nữ Tim Trắng cổ Bèo Cột Nơ Xoè Nhẹ Đuôi Cá Thời Trang,Mây Đầm Thiết Kế,220000.0,OEM,7.0,4.7,24.0,Đầm,VND,0
"Váy sơ mi nữ dáng dài chất liệu đũi mềm mát, thời trang hè nữ ARCTIC HUNTER AH162",Hai Fashion,299000.0,ARCTIC HUNTER,4.0,4.0,21.0,Áo,VND,0
"Đầm váy nữ thời trang họa tiết kiểu mùa hè Hàn Quốc dành cho phái nữ, Đầm nữ dáng xoè ARCTIC HUNTER AH35",Hai Fashion,199000.0,ARCTIC HUNTER,1.0,3.0,2.0,Váy,VND,0
"váy trễ vai trắng tay bồng dáng dài, đầm trễ vai tiểu thư dự tiệc màu trắng điệu đà",Thời trang Jellystore,90000.0,OEM,63.0,4.5,124.0,Váy,VND,0
VÁY ĐẦM XÒE MÀU ĐEN PHỐI CỔ TRẮNG ĐÍNH PHỤ KIỆN THANH LỊCH SIZE TỪ 40-70KG,THỜI TRANG TINA,149000.0,OEM,9.0,3.1,20.0,Váy,VND,0
Kính chống ánh sáng xanh chống tia UV Xiaomi mijia tiện dụng,Yingduoduo,379000.0,Xiaomi,1.0,5.0,3.0,Mắt Kính,VND,0
Váy đầm xòe dự tiệc công chúa màu trắng thanh lịch duyên dáng có bigsize mẫu mới giá rẻ đẹp,THỜI TRANG TINA,219000.0,OEM,1.0,5.0,6.0,Váy,VND,0
Đầm xòe sọc caro phối cổ trắng xinh xắn thanh lịch đủ size từ 38-71kg,THỜI TRANG TINA,139000.0,OEM,1.0,4.0,5.0,Đầm,VND,0
Đầm Xòe Hoa Xanh Cổ Ren Trắng Kèm Thắt Lưng Rời Chất Lụa Mango Nhập Cao Cấp Có Lót Trong Thanh Lịch 5 Size Mộc Garden,THỜI TRANG TINA,225000.0,OEM,1.0,5.0,2.0,Đầm,VND,0
ĐẦM XÒE CỔ VE TRẮNG THẮT EO DUYÊN DÁNG SIZE TỪ 40-71KG,THỜI TRANG TINA,149000.0,OEM,1.0,2.0,2.0,Đầm,VND,0
Kính Mát Chống Xiaomi Mijia Chống Tia UV400 Kiểu Dáng Thể Thao Năng Động,Yingduoduo,560000.0,Xiaomi,3.0,4.7,10.0,Mắt Kính,VND,0
"Xiaomi Mijia Pilota Kính râm phân cực  chống UV400 cho nam giới và phụ nữ lái xe chung, du lịch, quà tặng",Yingduoduo,729000.0,Xiaomi,8.0,5.0,11.0,Mắt Kính,VND,0
Kính đi nắng chống UV phân cực Xiaomi TS Turok Steinhardt bản Cao Cấp CHÍNH HÃNG-Hàng chính hãng,Yingduoduo,760000.0,Xiaomi,4.0,4.8,9.0,Mắt Kính,VND,0
Máy Sấy Và Khử Trùng Giày Xiaomi Youpin SOTHING DSHJ-S-1904 Zero-One Cầm Tay,Yingduoduo,334000.0,Xiaomi,2.0,5.0,7.0,Giày,VND,0
Xiaomi Kính Mát  Luke Chống Tia UV400 Chống Tia UV Cho Nam Nữ,MOKOEZ,561000.0,Xiaomi,1.0,5.0,2.0,Mắt Kính,VND,0
Balo Đựng Laptop 15.6 Inch Mark Ryden MR9813 Phong Cách Doanh Nhân Đơn Giản Thời Trang,YuanBao Global Store,559000.0,Mark Ryden,1.0,5.0,2.0,Balo/Cặp,VND,0
Áo Bơi Nam Dài Tay DIVE&SAIL (Size,Purger flagship store,1260000.0,DIVE&SAIL,1.0,5.0,3.0,Áo,VND,0
Bộ Đồ Lặn Biển Nữ Sbart - Tím,Purger flagship store,955000.0,SBART,1.0,4.0,2.0,Bộ,VND,0
Áo Bơi Nam Không Tay Kéo Khóa,Purger flagship store,949000.0,DIVE&SAIL,2.0,5.0,2.0,Áo,VND,0
Túi đeo chéo MARK RYDEN chống nước dành cho nam,YuanBao Global Store,529000.0,Mark Ryden,1.0,5.0,1.0,Túi,VND,0
Bộ Đồ Lặn Biển Nữ Sbart,Purger flagship store,918000.0,SBART,1.0,4.0,1.0,Bộ,VND,0
Áo đi xe đạp dài tay dành cho nam nữ làm bằng vải Polyester nhanh khô thoáng khí thoát ẩm-Màu vàng-Size N,Ideal outdoors,349000.0,WOSAWE,1.0,1.0,2.0,Áo,VND,0
Men's Rashguard Top Long Sleeve Swimsuit Spandex Elastic Snorkeling Surf Beach Clothing,Pugena flagship store,842000.0,SBART,1.0,4.0,0.0,Khác,VND,0
Women's Snorkeling Suit Short Sleeve One-Piece Swimwear Rashguard Lycra Surf Clothing Sbart,Purger flagship store,876000.0,SBART,1.0,4.0,4.0,Khác,VND,0
Bộ Đồ Bơi Dài Tay Bảo Vệ Cho Nam SBART ,Purger flagship store,867000.0,SBART,1.0,1.0,4.0,Bộ,VND,0
Ladies Short-Sleeved One-Piece Swimsuit Lycra Tight Surf Snorkeling Beachwear,Purger flagship store,848000.0,SBART,1.0,4.0,1.0,Khác,VND,0
Áo Bơi Dài Tay Khóa Kéo Bảo Vệ Cho Nữ SBART,Purger flagship store,745000.0,SBART,1.0,1.0,2.0,Áo,VND,0
Đồ Lặn Biển Cho Nam,Purger flagship store,999999.0,SBART,1.0,4.0,1.0,Khác,VND,0
"váy trễ vai trắng tay bồng dáng dài, đầm trễ vai tiểu thư dự tiệc màu trắng điệu đà",CỬA HÀNG LINH LINH,80000.0,OEM,43.0,4.5,135.0,Váy,VND,0
"Đầm xòe trắng dự tiệc cổ bẻ đính nút sang trọng, dáng đẹp GR186",Misa Fashion,165000.0,OEM,10.0,4.6,31.0,Đầm,VND,0
Đầm xòe đỏ kết hoa trắng-MS0605D,KHANH LINH STYLE,190000.0,KHANH LINH STYLE,21.0,4.8,78.0,Đầm,VND,0
Đầm nữ dự tiệc màu trắng dáng xòe cổ V,Mây Đầm Thiết Kế,300000.0,OEM,14.0,4.5,42.0,Đầm,VND,0
Đầm Ren Trắng Dễ Thương Kiểu Dạo Phố DN062 MayHomes,MAYHOMES Official Store,150000.0,MAYHOMES,3.0,4.7,11.0,Đầm,VND,0
"váy trễ vai trắng tay bồng dáng dài, đầm trễ vai tiểu thư dự tiệc sang chảnh",SUZYVI,85000.0,OEM,35.0,5.0,51.0,Váy,VND,0
Đầm Midi Trắng Cổ Vuông Viền Ren Thanh Lịch Nữ Tính Tay Ngắn,Mây Đầm Thiết Kế,320000.0,OEM,4.0,4.8,21.0,Đầm,VND,0
Đầm trắng xéo vai Laver Dress Gem Clothing SP001107,Gem clothing,560000.0,G.E.M,1.0,5.0,2.0,Váy,VND,0
"váy trễ vai trắng tay bồng dáng dài, đầm trễ vai tiểu thư dự tiệc màu trắng điệu đà",Vanvan,80000.0,OEM,18.0,4.6,40.0,Váy,VND,0
"Set váy yếm nữ 2 dây, đầm nữ dài maxi phối trắng dáng ulzang phong cách hàn quốc cá tính ( không kèm áo)",shop linh linh,92000.0,OEM,22.0,4.5,31.0,Áo,VND,0
"váy trễ vai trắng tay bồng dáng dài, đầm trễ vai tiểu thư dự tiệc sang chảnh",shop linh linh,79000.0,OEM,27.0,5.0,39.0,Váy,VND,0
Đầm trắng trễ vai cúc bọc siêu xinh  -  Váy trễ vai tiểu thư xinh xắn,Yume86 Shop,199000.0,OEM,1.0,5.0,1.0,Váy,VND,0
Đầm voan trắng công chúa xòe xếp tầng siêu xinh (hình thật/sẵn) - Đầm trắng dự tiệc,Yume86 Shop,189000.0,OEM,1.0,5.0,0.0,Đầm,VND,0
"Đầm maxi dài trắng, dáng xòe, đẹp nhẹ nhàng, tinh khôi, lưng trần đan dây quyến rũ | MX028",monkibaby,280000.0,OEM,1.0,2.0,4.0,Đầm,VND,0
Thiết Kế Thời Trang Barbie - Thời Trang Du Lịch,Nhà sách Fahasa,24300.0,OEM,2.0,5.0,13.0,Khác,VND,0
Barbie Thiết Kế Thời Trang - Tín Đồ Thời Trang,Nhà sách Fahasa,28800.0,OEM,2.0,5.0,8.0,Khác,VND,0
Đầm Jean Nữ Thời Trang,THỜI TRANG TINA,188000.0,OEM,9.0,4.3,37.0,Đầm,VND,0
ĐẦM BẦU THỜI TRANG DN19081712,DONA Thời Trang,170000.0,OEM,5.0,4.5,16.0,Đầm,VND,0
CHÂN VÁY CÁCH ĐIỆU THỜI TRANG,THỜI TRANG BOBOSHOP,130000.0,OEM,1.0,5.0,2.0,Váy,VND,0
"Cắt May Thời Trang - Các Kiểu Váy, Áo, Thời Trang Nữ",Việt Thư Books,55500.0,OEM,13.0,4.8,89.0,Áo,VND,0
Áo kiểu bo eo thời trang,Thời Trang MYMYSHOP,169000.0,OEM,2.0,3.5,22.0,Áo,VND,0
Kính Thời Trang Mắt Tròn To Ulzzang Thời Trang (Đồi Mồi),Kính Xinh,89000.0,LALAMIA,1.0,5.0,1.0,Mắt Kính,VND,0
Sét Đồ Bộ Nữ Thời Trang,THỜI TRANG TINA,99000.0,OEM,12.0,3.9,46.0,Bộ,VND,0
Áo Jean Liền Quần Thời Trang,THỜI TRANG TINA,195000.0,OEM,9.0,4.3,33.0,Áo,VND,0
Đầm Yếm Nữ Jean Thời Trang,THỜI TRANG TINA,232000.0,OEM,1.0,1.0,4.0,Đầm,VND,0
Áo kiểu bo ly thời trang,Thời Trang MYMYSHOP,189000.0,OEM,12.0,4.1,42.0,Áo,VND,0
Kính râm Thời Trang Millionaire Màu Hồng thời trang Ulzzang Hàn Quốc,Kính Xinh,200000.0,LALAMIA,1.0,5.0,1.0,Mắt Kính,VND,0
Chân váy Anni phối nút thời trang,Thời Trang MYMYSHOP,185000.0,OEM,10.0,4.2,130.0,Váy,VND,0
Đầm Công Sở Phối Ren Thời Trang,THỜI TRANG TINA,183200.0,OEM,7.0,4.7,16.0,Đầm,VND,0
CHÂN VÁY THỜI TRANG CÔNG SỞ MỚI,THỜI TRANG BOBOSHOP,131000.0,OEM,4.0,4.3,6.0,Váy,VND,0
Balo Mini Nữ Thời Trang cao cấp thời trang – BEE GEE BLNN9020,BEE GEE SHOP,235000.0,Bee Gee,3.0,2.3,7.0,Balo/Cặp,VND,0
Balo Nữ Mini Thời Trang Da Mềm thời trang – BEE GEE BLNN9010,BEE GEE SHOP,820000.0,Bee Gee,1.0,2.0,1.0,Balo/Cặp,VND,0
NÓN MŨ BERE THỜI TRANG DN19111715,DONA Thời Trang,144000.0,OEM,1.0,4.0,4.0,Nón/Mũ,VND,0
Set thời trang 788881,New Sky Shop 18,220000.0,OEM,1.0,5.0,3.0,Bộ,VND,0
Balo Thời Trang Kết Hợp Túi Đeo Chéo Thời Trang HARAS HR278,HARASMALL,250000.0,HARAS,3.0,3.7,21.0,Túi,VND,0
Túi xách nữ thời trang cao cấp thời trang – BEE GEE TN1006,BEE GEE SHOP,180000.0,Bee Gee,1.0,5.0,10.0,Túi,VND,0
BỘ ĐỒ THỜI TRANG MÙA HÈ dn20041302,DONA Thời Trang,99000.0,OEM,4.0,4.5,13.0,Bộ,VND,0
BỘ ĐỒ THỜI TRANG MÙA HÈ dn20041301,DONA Thời Trang,99000.0,OEM,2.0,5.0,4.0,Bộ,VND,0
Áo Sơ Mi Nữ Công Sở Thời Trang,THỜI TRANG TINA,207000.0,OEM,3.0,3.3,12.0,Áo,VND,0
"Mũ nón len bere nữ, Nón bere thời trang dn19111305",DONA Thời Trang,130000.0,OEM,4.0,4.3,24.0,Nón/Mũ,VND,0
Đầm bầu thời trang khoét vai DN1908205,DONA Thời Trang,144000.0,OEM,1.0,5.0,2.0,Đầm,VND,0
Dẫn Luận Về Thời Trang,Tiki Trading,58600.0,OEM,58.0,4.6,731.0,Khác,VND,-1
Băng đô caro thời trang,AUCOSTA,38000.0,OEM,8.0,4.0,37.0,Khác,VND,0
Balo Mini Nữ Thời Trang Da cao cấp thời trang – BEE GEE BLNN9012,BEE GEE SHOP,385000.0,Bee Gee,2.0,4.5,4.0,Balo/Cặp,VND,0
"mũ lưỡi trai thời trang, nón jeans rách thời trang cá tính - màu xanh",Thế Giới Nón Store,53900.0,OEM,1.0,5.0,6.0,Nón/Mũ,VND,0
Bộ Trang Sức Nữ Thời Trang sang chảnh,Lovelyladyshop,165000.0,OEM,5.0,4.6,21.0,Bộ,VND,0
NÓN VÀNH BUCKET THỜI TRANG,Nón Hiền,30282.0,OEM,2.0,5.0,18.0,Nón/Mũ,VND,0
Băng đô da thời trang,ShopDucThang,60000.0,OEM,1.0,3.0,1.0,Khác,VND,0
Thời Trang Dự Tiệc - Barbie,Tiki Trading,28600.0,OEM,5.0,5.0,29.0,Khác,VND,0
Balo thời trang SAKOS ARMORE,Balonation,1096640.0,Sakos,8.0,3.9,16.0,Balo/Cặp,VND,0
Sandal Bitis nữ thời trang,ShopDucThang,286150.0,Biti's,2.0,5.0,7.0,Giày,VND,0
Sandal Bitis nữ thời trang,ShopDucThang,289060.0,Biti's,1.0,5.0,6.0,Giày,VND,0
"Mũ nón len bere nữ, Nón bere thời trang dn19111301",DONA Thời Trang,144000.0,OEM,5.0,5.0,17.0,Nón/Mũ,VND,0
Đầm Jean Suông Cổ V Tay Ngắn Thời Trang,THỜI TRANG TINA,190000.0,OEM,4.0,4.8,9.0,Đầm,VND,0
Áo Khoác Vest Jean Nữ Cổ Bẻ Thời Trang,THỜI TRANG TINA,219000.0,OEM,1.0,4.0,2.0,Áo,VND,0
Đầm Jean Body Ngắn Tay Phối Túi Thời Trang,THỜI TRANG TINA,214000.0,OEM,3.0,3.3,5.0,Túi,VND,0
nón beret nữ mũ bere thời trang dn1911103,DONA Thời Trang,138000.0,OEM,3.0,4.3,6.0,Nón/Mũ,VND,0
Nhẫn Nam Inox Thời Trang Chữ Phước-NN667,Trang sức 2L,65000.0,OEM,6.0,4.8,13.0,Phụ kiện,VND,0
Balo Thời Trang PRAZA - BL172,Praza,149000.0,Praza,114.0,4.6,678.0,Balo/Cặp,VND,-1
Kẹp Búi Tóc Lưới Thời Trang,Vnhaxanh,59000.0,OEM,1.0,4.0,17.0,Phụ kiện,VND,0
Dây đeo gọng kính thời trang,MUANHANH,98400.0,ROSAVAN,1.0,2.0,1.0,Mắt Kính,VND,0
Balo Mini Nữ Thời Trang Da cao cấp thời trang HÀN QUỐC – BEE GEE BLNN9013,BEE GEE SHOP,360000.0,Bee Gee,2.0,5.0,4.0,Balo/Cặp,VND,0
Balo thời trang LATA BAL39,LATA OFFICIAL,750000.0,Lata,1.0,5.0,4.0,Balo/Cặp,VND,0
 Băng Dính Thời Trang FaSoLa PK236,Bra Rosie,33000.0,OEM,1.0,4.0,4.0,Khác,VND,0
Áo khoác nỉ nữ thời trang,Xưởng Quần Áo Đẹp,157000.0,VONESA,1.0,5.0,1.0,Áo,VND,0
Quần lót Nam Boxer thời trang,shopthoitranganhnguyen,99000.0,OEM,16.0,4.6,36.0,Quần,VND,0
Balo thời trang Mikkor The Estelle,BALO MỚI,599000.0,Mikkor,3.0,4.7,11.0,Balo/Cặp,VND,0
Balo thời trang Simplecarry F2,BALO MỚI,440000.0,SimpleCarry,3.0,5.0,5.0,Balo/Cặp,VND,0
Găng tay chống nắng thời trang,MrsTruongShop,10000.0,OEM,5.0,3.6,40.0,Găng Tay,VND,0
Túi Xách Nam Nữ Thời Trang,Balo Teen,69000.0,HAKI,1.0,5.0,2.0,Túi,VND,0
Kính râm màu vàng thời trang,CECE STORE,120000.0,CeCe CiCi,1.0,5.0,1.0,Mắt Kính,VND,0
Áo Len Nữ Cổ Chui Thời Trang Mới Hàn Quốc ALN035 MayHomes Thời Trang Thu Đông,MAYHOMES Official Store,189050.0,MAYHOMES,24.0,4.8,100.0,Áo,VND,0
Hộp đựng mắt kính thời trang,shopthoitranganhnguyen,29000.0,OEM,27.0,4.7,86.0,Mắt Kính,VND,0
Balo nam thời trang cao cấp,Ananshop688,351000.0,ANANSHOP688,10.0,3.7,27.0,Balo/Cặp,VND,0
Áo đũi nam thời trang đẹp,SZone,89000.0,SZone,1.0,5.0,22.0,Áo,VND,0
"Nón vành,mũ bucket thời trang",Nón Hiền,26460.0,OEM,1.0,4.0,6.0,Nón/Mũ,VND,0
Túi tote thời trang May 10,May 10,189000.0,May 10,1.0,4.0,6.0,Túi,VND,0
NÓN MŨ LEN NAM THỜI TRANG HÀN QUỐC DN19112415,DONA Thời Trang,130000.0,OEM,14.0,4.3,116.0,Nón/Mũ,VND,0
Nón mũ beret nữ thời trang Hàn Quốc dn19081602,DONA Thời Trang,174000.0,OEM,2.0,5.0,8.0,Nón/Mũ,VND,0
Hộp đựng kính cận thời trang,shopthoitranganhnguyen,18000.0,OEM,93.0,4.7,304.0,Mắt Kính,VND,-1
Kẹp Búi Tóc Lưới Thời Trang,Vnhaxanh,29000.0,OEM,3.0,4.7,20.0,Phụ kiện,VND,0
Áo thun ECKO cực thời trang,Xưởng Quần Áo Đẹp,94000.0,VONESA,3.0,4.0,5.0,Áo,VND,0
Thời Trang Búp Bê (Tập 4),Nhà sách Fahasa,19800.0,OEM,9.0,4.1,53.0,Khác,VND,0
Dép Thời Trang Nam Cao Cấp,GiayLeSang,29000.0,Lê Sang,97.0,4.8,283.0,Dép,VND,-1
Ba lô nữ thời trang cao cấp,Ananshop688,383000.0,ANANSHOP688,24.0,4.5,71.0,Balo/Cặp,VND,0
 Đầm hoa nút mây thời trang,Hương Nemo Style,165000.0,VONESA,1.0,5.0,1.0,Đầm,VND,0
VALI THỜI TRANG TRẺ EM KTP02,NPP Kim Trường Phú,470000.0,KTP,1.0,1.0,2.0,Khác,VND,0
Áo Khoác Jean Nữ Dài Tay Nón Trùm Thời Trang,THỜI TRANG TINA,219000.0,OEM,1.0,3.0,3.0,Áo,VND,0
(1 CHIẾC) NHẪN ĐÔI TÌNH NHẪN THỜI TRANG,Trang sức 2L,23000.0,OEM,4.0,5.0,19.0,Phụ kiện,VND,0
NÓN LEN LÔNG THỎ THỜI TRANG HÀN QUỐC DN19122302,DONA Thời Trang,160000.0,OEM,7.0,4.3,21.0,Nón/Mũ,VND,0
Nón mũ bere nữ thời trang Hàn Quốc dn19081601,DONA Thời Trang,164000.0,OEM,1.0,5.0,9.0,Nón/Mũ,VND,0
Áo Khoác Jean Nữ Dài Tay Kèm Nón Thời Trang,THỜI TRANG TINA,219000.0,OEM,8.0,3.5,26.0,Áo,VND,0
Sách Thời trang Công chúa Cổ tích (4 trang stickers),Tiki Trading,33000.0,OEM,1.0,5.0,9.0,Khác,VND,0
NÓN MŨ LEN NAM THỜI TRANG HÀN QUỐC DN19112416,DONA Thời Trang,130000.0,OEM,17.0,4.7,79.0,Nón/Mũ,VND,0
Nhẫn Nam Mặt Trơn Thời Trang Cá Tính-NN620,Trang sức 2L,64000.0,OEM,2.0,5.0,16.0,Phụ kiện,VND,0
Balo UNISEX  Thời Trang HARAS HRS008,HARASMALL,200000.0,HARAS,150.0,4.7,500.0,Balo/Cặp,VND,-1
Cặp công sở thời trang CAYUUMY06,LATA OFFICIAL,235000.0,YUUMY,22.0,4.8,80.0,Balo/Cặp,VND,0
Túi xách nữ thời trang cao cấp,Ananshop688,423000.0,ANANSHOP688,23.0,4.6,45.0,Túi,VND,0
Balo thời trang Idigo FB2-372,IDIGO,225720.0,IDIGO,4.0,4.0,12.0,Balo/Cặp,VND,0
Giày nữ thời trang ELLY – EG227,ELLY,574500.0,Elly,1.0,5.0,1.0,Giày,VND,0
Khăn choàng cổ lụa thời trang 10,MISA Shop,234000.0,OEM,1.0,2.0,6.0,Khăn,VND,0
"Túi đeo chéo nam thời trang, Túi đeo ngực nam da bò cao cấp thời trang công sở",SIÊU THỊ ONLINE 360,241000.0,BISAGO,3.0,4.7,15.0,Túi,VND,0
Mũ len nón len nữ thời trang Hàn Quốc dn19111314,DONA Thời Trang,174000.0,OEM,5.0,3.8,17.0,Nón/Mũ,VND,0
Mũ vành thời trang NÓN SƠN MH021-TR1,Thời Trang Nón Sơn Official,568000.0,Nón Sơn,1.0,5.0,2.0,Nón/Mũ,VND,0
Áo kiểu nữ thời trang cổ trụ tay phồng xinh đẹp,THỜI TRANG TINA,165000.0,OEM,6.0,4.2,15.0,Áo,VND,0
nón mũ nồi bere nữ thời trang Hàn Quốc dn1911101,DONA Thời Trang,154000.0,OEM,3.0,5.0,10.0,Nón/Mũ,VND,0
Dán Hình Sáng Tạo Trang Phục Búp Bê - Thời Trang Xưa,Nhà sách Fahasa,55000.0,OEM,1.0,5.0,18.0,Khác,VND,0
Khẩu Trang Vải Kháng Khuẩn Thời Trang Miley Lingerie 2 lớp,Miley Lingerie,10000.0,Miley Lingerie,14.0,4.5,211.0,Khác,VND,0
"Áo khoác chống nắng nữ cao cấp - thời trang, thoáng mát",THỜI TRANG WINFA,119000.0,WINFA,1.0,5.0,7.0,Khác,VND,0
"nón beret nữ, mũ beret nữ thời trang mới dn19110704",DONA Thời Trang,138000.0,OEM,11.0,4.6,42.0,Nón/Mũ,VND,0
Mũ len nón len nữ thời trang Hàn Quốc dona21120601,DONA Thời Trang,114000.0,OEM,2.0,4.5,6.0,Nón/Mũ,VND,0
Chân váy xếp ly 3 khuy thời trang Banamo Fashion 5333,Thời trang Banamo,110000.0,OEM,9.0,4.3,11.0,Váy,VND,0
Khăn choàng nữ len lông thời trang thanh lịch dona21101911,DONA Thời Trang,99000.0,OEM,1.0,5.0,2.0,Khăn,VND,0
MŨ  NÓN RỘNG VÀNH THỜI TRANG MỚI - DN19VN0737,DONA Thời Trang,99000.0,OEM,2.0,4.0,5.0,Nón/Mũ,VND,0
Khăn lụa trang trí túi xách thời trang Yuumy YK1,LATA OFFICIAL,9000.0,YUUMY,2.0,5.0,50.0,Túi,VND,0
Áo Khoác Jean Nữ Tay Phối Nỉ Nón Trùm Thời Trang,THỜI TRANG TINA,185000.0,OEM,19.0,4.3,64.0,Áo,VND,0
Áo Khoác Jean Nữ Dài Tay Đính Viền Màu Thời Trang,THỜI TRANG TINA,255000.0,OEM,8.0,4.3,18.0,Áo,VND,0
Móc khóa thời trang YUUMY YMK7,LATA OFFICIAL,19000.0,YUUMY,10.0,5.0,41.0,Khác,VND,0
Túi xách nữ thời trang cao cấp,Ananshop688,327000.0,ANANSHOP688,16.0,4.5,53.0,Túi,VND,0
Cặp công sở thời trang Cayuumy09,YUUMY OFFICIAL,219000.0,YUUMY,3.0,4.3,8.0,Balo/Cặp,VND,0
Hộp đựng đồng hồ da Thời trang,shopthoitranganhnguyen,75000.0,OEM,11.0,4.5,37.0,Đồng Hồ,VND,0
Winx Club - Thời Trang Phép Thuật 2,Nhà sách Fahasa,53600.0,OEM,1.0,5.0,2.0,Khác,VND,0
Giày nữ thời trang  ELLY – EG220,ELLY,474500.0,Elly,1.0,5.0,1.0,Giày,VND,0
Dây Lưng Nam Thời Trang Phong Cách,HT Sports Official,39000.0,HT Sports,1.0,5.0,2.0,Khác,VND,0
Dây chuyền chuỗi đá Opal thời trang,Bé Heo,138000.0,OEM,1.0,5.0,3.0,Phụ kiện,VND,0
Khăn choàng cổ lụa thời trang 02,MISA Shop,210000.0,Micoem,1.0,4.0,1.0,Khăn,VND,0
Áo len cadigan thời trang V0023,Moon Fashion,179000.0,TAKIHA,3.0,5.0,16.0,Áo,VND,0
Jum tay dài thời trang dạ hội,Xưởng Quần Áo Đẹp,194000.0,VONESA,1.0,5.0,8.0,Khác,VND,0
Túi xách nữ thời trang cao cấp,Ananshop688,441000.0,ANANSHOP688,13.0,4.7,25.0,Túi,VND,0
Cặp công sở thời trang CAYUUMY07,LATA OFFICIAL,235000.0,YUUMY,18.0,4.5,34.0,Balo/Cặp,VND,0
Balo laptop thời trang đa năng Ozuko,Boss Baby Shop,1000000.0,OZUKO,1.0,5.0,3.0,Balo/Cặp,VND,0
Đầm cổ tàu xẻ tà thời trang,Xưởng Quần Áo Đẹp,269000.0,VONESA,1.0,5.0,1.0,Đầm,VND,0
Sandal nữ đế xuồng thời trang 21814,ĐỒ DA THÀNH LONG TLG,145000.0,ĐỒ DA THÀNH LONG TLG,1.0,5.0,1.0,Giày,VND,0
Túi đeo chéo thời trang bằng vải,Anna Trần Shop,54000.0,Anna Tran,1.0,5.0,2.0,Túi,VND,0
Khăn choàng cổ lụa thời trang 34,MISA Shop,234000.0,OEM,1.0,1.0,0.0,Khăn,VND,0
Ba Lô Thời Trang UNISEX HARAS HRTK0233,HARASMALL,170000.0,HARAS,38.0,4.5,207.0,Balo/Cặp,VND,0
Móc khóa thời trang LATA MK6,LATA OFFICIAL,89000.0,Lata,15.0,5.0,76.0,Khác,VND,0
Balo Mini Thời Trang FALDO Luxury Bee,FALDO,97000.0,FALDO,19.0,4.3,123.0,Balo/Cặp,VND,0
Bộ Balo Thời Trang HARAS HR133083,HARASMALL,200000.0,HARAS,26.0,4.7,55.0,Balo/Cặp,VND,0
Quần bơi nam thời trang - Q002,MONNO Fashion,230000.0,OEM,2.0,5.0,2.0,Quần,VND,0
Sandal Bitis nam thời trang (38-44),ShopDucThang,388000.0,Biti's,2.0,5.0,5.0,Giày,VND,0
Ba Lô Thời Trang Hàn Quốc HR2038,HARASMALL,270000.0,HARAS,2.0,4.5,28.0,Balo/Cặp,VND,0
Quần Sọt Lính Túi Hộp Thời Trang,PONIVA,188000.0,OEM,1.0,4.0,11.0,Quần,VND,0
Thiết Kế Thời Trang Cho Búp Bê,Nhà sách Fahasa,66400.0,OEM,6.0,5.0,59.0,Khác,VND,0
Áo sơ mi nam sọc thời trang,SOMINAM,149000.0,OEM,10.0,3.4,30.0,Áo,VND,0
Móc khóa thời trang YUUMY YMK10,LATA OFFICIAL,19000.0,YUUMY,9.0,4.2,290.0,Khác,VND,-1
Móc khóa thời trang YUUMY YMK11,LATA OFFICIAL,19000.0,YUUMY,3.0,5.0,12.0,Khác,VND,0
Thiết Kế Thời Trang Nữ - Xuân Hè ,Nhà sách Fahasa,88500.0,OEM,3.0,4.7,8.0,Khác,VND,0
Găng tay chống nắng thời trang - nude,Group Case TTM,15000.0,OEM,1.0,4.0,1.0,Găng Tay,VND,0
"Khẩu trang vải Azumikichi màu đen, khẩu trang thời trang cao cấp sang trọng",Azumikichi,25000.0,AZUMIKICHI,116.0,4.8,509.0,Khác,VND,-1
Áo Vest Nữ thời trang Zart - VESTSE,Zart Fashion,239000.0,ZART,2.0,4.5,7.0,Áo,VND,0
Ví cầm tay thời trang Unisex LATA VN34,LATA OFFICIAL,259000.0,Lata,3.0,5.0,13.0,Túi,VND,0
Ví Cầm Tay Thời Trang FALDO Chống Thấm Nước,FALDO,51000.0,FALDO,14.0,4.1,34.0,Túi,VND,0
Combo balo thời trang HARAS HR222,HARASMALL,250000.0,HARAS,2.0,4.0,44.0,Balo/Cặp,VND,0
Ví cầm tay nữ thời trang LATA VN52,LATA OFFICIAL,239000.0,Lata,1.0,4.0,7.0,Túi,VND,0
Kẹp tóc thời trang.Kiểu kẹp gài.XX046,Song An Eco,22000.0,OEM,3.0,4.3,14.0,Phụ kiện,VND,0
Quần ống rộng vải đũi thời trang,Hai Fashion,119000.0,OEM,1.0,5.0,5.0,Quần,VND,0
Balo Thời Trang Campus PRAZA - BLTK177,Praza,179000.0,Praza,29.0,4.2,212.0,Balo/Cặp,VND,0
Xe Đạp Thời Trang Dunlop Nam - Đỏ,Cửa Hàng Xe Đạp CT Bike,2760000.0,Dunlop,8.0,4.5,25.0,Khác,VND,-1
GIÀY NỮ THỜI TRANG ELLY- EG244,ELLY,1094400.0,Elly,1.0,5.0,1.0,Giày,VND,0
Túi xách nữ thời trang cao cấp,Ananshop688,315000.0,ANANSHOP688,2.0,5.0,12.0,Túi,VND,0
Áo thun Nam có cổ thời trang,shopthoitranganhnguyen,150000.0,OEM,2.0,5.0,16.0,Áo,VND,0
Balo thời trang Fortune Mouse B197,Fortune Mouse Official Store,180000.0,Fortune Mouse,1.0,5.0,3.0,Balo/Cặp,VND,0
Bông tai nam đẹp chất thời trang,haopo,60000.0,OEM,1.0,5.0,12.0,Phụ kiện,VND,0
Nón mũ len khăn choàng nam thời trang Hàn Quốc don22010402,DONA Thời Trang,164000.0,OEM,9.0,5.0,37.0,Nón/Mũ,VND,0
MŨ RỘNG VÀNH NỮ THỜI TRANG HÀN QUỐC - DN19VT0726,DONA Thời Trang,154000.0,OEM,7.0,4.0,27.0,Nón/Mũ,VND,0
MŨ RỘNG VÀNH  NỮ THỜI TRANG HÀN QUỐC - DN19VN0706,DONA Thời Trang,99000.0,OEM,1.0,3.0,0.0,Nón/Mũ,VND,0
Mũ vành thời trang NÓN SƠN-MH009-VG1-L,Thời Trang Nón Sơn Official,875000.0,Nón Sơn,1.0,5.0,1.0,Nón/Mũ,VND,0
Nón mũ bere nữ thời trang Hàn Quốc hàng nhập dn19110707,DONA Thời Trang,154000.0,OEM,1.0,5.0,9.0,Nón/Mũ,VND,0
MŨ CAO BỒI NỮ  PANAMA THỜI TRANG MỚI - DN19CB0702,DONA Thời Trang,99000.0,OEM,1.0,5.0,5.0,Nón/Mũ,VND,0
Balo Thời Trang Unisex PRAZA - BL167 (Xám),Praza,145000.0,Praza,38.0,4.5,379.0,Balo/Cặp,VND,-1
Giày thời trang nam NIKE COURT VISION LO,Tiki Trading,1459000.0,Nike,6.0,4.7,25.0,Giày,VND,0
"nón bere lông thỏ đính hạt, mũ bere thời trang dn19081813",DONA Thời Trang,170000.0,OEM,2.0,3.5,7.0,Nón/Mũ,VND,0
Balo Thời Trang Công Sở PRAZA - BL167 (Đỏ),Praza,145000.0,Praza,26.0,4.5,540.0,Balo/Cặp,VND,-1
NÓN  VÀNH NỮ THỜI TRANG HÀN QUỐC MỚI - DN19VN0726,DONA Thời Trang,99000.0,OEM,1.0,4.0,0.0,Nón/Mũ,VND,0
MŨ RỘNG VÀNH NỮ THỜI TRANG HÀN QUỐC - DN19VT0727,DONA Thời Trang,154000.0,OEM,1.0,5.0,12.0,Nón/Mũ,VND,0
NÓN MŨ BERE LEN LÔNG THỎ THỜI TRANG HÀN QUỐC DN19122308,DONA Thời Trang,160000.0,OEM,1.0,5.0,3.0,Nón/Mũ,VND,0
Kẹp Búi Tóc Lưới Đính Hạt Thời Trang,Vnhaxanh,55000.0,OEM,1.0,5.0,14.0,Phụ kiện,VND,0
Túi xách nữ thời trang ELLY – EL269,ELLY,1004300.0,Elly,1.0,5.0,1.0,Túi,VND,0
Vòng Cổ Choker Tattoo V72 Thời Trang,Ant home,16000.0,Song An Eco,3.0,2.7,34.0,Vòng,VND,0
Áo thun Nam body thời trang - AT019,shopthoitranganhnguyen,180000.0,OEM,6.0,4.8,16.0,Áo,VND,0
Kẹp Tóc Đính Đá Thời Trang Cao cấp,Vnhaxanh,79000.0,OEM,5.0,5.0,14.0,Phụ kiện,VND,0
Áo khoác nỉ 2 da thời trang SITAKI,sitaki store,325000.0,OEM,2.0,2.5,4.0,Áo,VND,0
Ví nữ cầm tay chiếc lá thời trang,Balo Teen,75999.0,HAKI,3.0,3.3,41.0,Túi,VND,0
set bông tai thời trang nữ GJO111,Thiên Hoàng Store,15000.0,OEM,1.0,5.0,1.0,Bộ,VND,0
Dép Vento Quai Ngang Thời Trang AD22,Giày Dép Sandal,200000.0,Vento,1.0,5.0,1.0,Dép,VND,0
Váy chống nắng hai túi ENVY VCN04 thời trang thiết kế,THỜI TRANG ENVY,384000.0,ENVY,1.0,5.0,5.0,Váy,VND,0
QUẦN TÂY NAM QUẦN ÂU NAM THỜI TRANG DN20010513,DONA Thời Trang,144000.0,OEM,12.0,3.9,37.0,Quần,VND,0
NÓN CÓI NỮ THỜI TRANG HÀN QUỐC MỚI - DN19VN0712,DONA Thời Trang,99000.0,OEM,2.0,2.5,9.0,Nón/Mũ,VND,0
Balo Đeo Chéo Thời Trang Nam YBAC1,LATA OFFICIAL,189000.0,YUUMY,28.0,5.0,73.0,Balo/Cặp,VND,0
NÓN MŨ BERE LEN LÔNG THỎ THỜI TRANG HÀN QUỐC DN19122304,DONA Thời Trang,160000.0,OEM,1.0,5.0,11.0,Nón/Mũ,VND,0
